{"schemaVersion":"htb.evidence-bundle.v1","runId":"run-0732435e2c94584931a311c2719b4c80","manifest":{"schemaVersion":"v1","runId":"run-0732435e2c94584931a311c2719b4c80","runSpecDigest":"dd371409acd70439665ae6c169a77a165b18e51a10b97ec76672af11295a4966","observationPlanDigest":"9881227faad510c0c98ed83caa09ea81c845e733e94603f990409b809b390339","capabilityManifestDigest":"b2c6a4dd407df1add3b0b679a6f99382c3f163e0abc31630a7c48de5401b2caf","sensorHealthDigest":"4acd86f9da85c780f06b01084c914052bd3c66302eaab108e7bfa8700ea2e82e","trackedEventChainHead":"54cb02a1a088adb863cc51c66c609ec507936f383bd87bd8fea22cfb568fdfa5","rawChainHeads":{"mock-boundary":"b671cd8aaa37a3e8e817df899a9c589992206d1105197e29ed2478fb00ca7608","mock-plaintext":"2289c5432ce5d2f8fad797b560e6bfd05adc5f76c56cf6a7338206b1ea2b9532","mock-provider":"838c0e52e5ea52ebb37bbe56855f280154c49f0f9c4126cfbdff20e6ec053601","mock-system":"17247ed39d79f2cef4c52452510e435ebc986aa31050c9e36c4b9edf39b3b2b0"},"artifacts":[{"path":"api-run-spec.json","sha256":"2d670240b2e30ef3c5f73bb8d00df624728ca7a02958b644126a5a1164ae2e46","size":113},{"path":"capability-manifest.json","sha256":"ab2fe1f5f51cbc96bd7398362060e7ca8b1c797fb768f601bbe64d59104e3482","size":575},{"path":"observation-plan.json","sha256":"d00c36364cc7c397b361889a82bb19be2df67f79349bd3f26c822dd1bb929987","size":167},{"path":"raw-records.json","sha256":"ddfcf5878f6948314b5d20a47c9cae7fc94fb37f4525bc14fd508dc03a84893d","size":10520},{"path":"run-spec.json","sha256":"c6be36f64708739a0906ff6f9672d08aaadbdc3139d1ce89114956b1e007cd6e","size":420},{"path":"sensor-health.json","sha256":"07688ffdadb22c2ab558f0ba2193af7eccf88c0fb833bcc20fdf7544e6e5ba45","size":1178},{"path":"tracked-events.jsonl","sha256":"82469dddcef26c3ff241ba9bea88615429ca45958a4c48327d2b02d4d0006e2b","size":14260},{"path":"tracked-events.jsonl.sealed","sha256":"42bdb14aa71e9768e7fc0522b17b521fefb113696f33da51ab5b4b47c502282d","size":65},{"path":"verification.json","sha256":"5a3288eda6dfc22ee932cb5bccec50dea7cbaf37944460144feab958078fbc75","size":281},{"path":"workload/raw-records.bin","sha256":"124105083da169ed703e5eecf84ce4136d51ad2f345a0a975a1c8e361f4819cc","size":6495}],"merkleRoot":"3a83bd0f49a4d7e3e53fe1b0993ab6f3b54a451c3049946839a6a77a2101417f","signature":"0oRDoQEnoFkI3khUQi9ydW4tZXZpZGVuY2UtbWFuaWZlc3Qtc2lnbmF0dXJlL3YxAHsic2NoZW1hVmVyc2lvbiI6InYxIiwicnVuSWQiOiJydW4tMDczMjQzNWUyYzk0NTg0OTMxYTMxMWMyNzE5YjRjODAiLCJydW5TcGVjRGlnZXN0IjoiZGQzNzE0MDlhY2Q3MDQzOTY2NWFlNmMxNjlhNzdhMTY1YjE4ZTUxYTEwYjk3ZWM3NjY3MmFmMTEyOTVhNDk2NiIsIm9ic2VydmF0aW9uUGxhbkRpZ2VzdCI6Ijk4ODEyMjdmYWFkNTEwYzBjOThlZDgzY2FhMDllYTgxYzg0NWU3MzNlOTQ2MDNmOTkwNDA5YjgwOWIzOTAzMzkiLCJjYXBhYmlsaXR5TWFuaWZlc3REaWdlc3QiOiJiMmM2YTRkZDQwN2RmMWFkZDNiMGI2NzlhNmY5OTM4MmMzZjE2M2UwYWJjMzE2MzBhN2M0OGRlNTQwMWIyY2FmIiwic2Vuc29ySGVhbHRoRGlnZXN0IjoiNGFjZDg2ZjlkYTg1Yzc4MGYwNmIwMTA4NGM5MTQwNTJiZDNjNjYzMDJlYWFiMTA4ZTdiZmE4NzAwZWEyZTgyZSIsInRyYWNrZWRFdmVudENoYWluSGVhZCI6IjU0Y2IwMmExYTA4OGFkYjg2M2NjNTFjNjZjNjA5ZWM1MDc5MzZmMzgzYmQ4N2JkOGZlYTIyY2ZiNTY4ZmRmYTUiLCJyYXdDaGFpbkhlYWRzIjp7Im1vY2stYm91bmRhcnkiOiJiNjcxY2Q4YWFhMzdhM2U4ZTgxN2RmODk5YTljNTg5OTkyMjA2ZDExMDUxOTdlMjllZDI0NzhmYjAwY2E3NjA4IiwibW9jay1wbGFpbnRleHQiOiIyMjg5YzU0MzJjZTVkMmY4ZmFkNzk3YjU2MGU2YmZkMDVhZGM1Zjc2YzU2Y2Y2YTczMzgyMDZiMWVhMmI5NTMyIiwibW9jay1wcm92aWRlciI6IjgzOGMwZTUyZTVlYTUyZWJiMzdiYmU1Njg1NWYyODAxNTRjNDlmMGY5YzQxMjZjZmJkZmYyMGU2ZWMwNTM2MDEiLCJtb2NrLXN5c3RlbSI6IjE3MjQ3ZWQzOWQ3OWYyY2VmNGM1MjQ1MjUxMGU0MzVlYmM5ODZhYTMxMDUwYzllMzZjNGI5ZWRmMzliM2IyYjAifSwiYXJ0aWZhY3RzIjpbeyJwYXRoIjoiYXBpLXJ1bi1zcGVjLmpzb24iLCJzaGEyNTYiOiIyZDY3MDI0MGIyZTMwZWYzYzVmNzNiYjhkMDBkZjYyNDcyOGNhN2EwMjk1OGI2NDQxMjZhNWExMTY0YWUyZTQ2Iiwic2l6ZSI6MTEzfSx7InBhdGgiOiJjYXBhYmlsaXR5LW1hbmlmZXN0Lmpzb24iLCJzaGEyNTYiOiJhYjJmZTFmNWY1MWNiYzk2YmQ3Mzk4MzYyMDYwZTdjYThiMWM3OTdmYjc2OGY2MDFiYmU2NGQ1OTEwNGUzNDgyIiwic2l6ZSI6NTc1fSx7InBhdGgiOiJvYnNlcnZhdGlvbi1wbGFuLmpzb24iLCJzaGEyNTYiOiJkMDBjMzYzNjRjYzdjMzk3YjM2MTg4OWE4MmJiMTliZTJkZjY3Zjc5MzQ5YmQzZjI2YzgyMmRkMWJiOTI5OTg3Iiwic2l6ZSI6MTY3fSx7InBhdGgiOiJyYXctcmVjb3Jkcy5qc29uIiwic2hhMjU2IjoiZGRmY2Y1ODc4ZjY5NDgzMTRiNWQyMGE0N2M5Y2FlN2ZjOTRmYjM3ZjQ1MjViYzE0ZmQ1MDhkYzAzYTg0ODkzZCIsInNpemUiOjEwNTIwfSx7InBhdGgiOiJydW4tc3BlYy5qc29uIiwic2hhMjU2IjoiYzZiZTM2ZjY0NzA4NzM5YTA5MDZmZjZmOTY3MmQwOGFhYWRiZGMzMTM5ZDFjZTg5MTE0OTU2YjFlMDA3Y2Q2ZSIsInNpemUiOjQyMH0seyJwYXRoIjoic2Vuc29yLWhlYWx0aC5qc29uIiwic2hhMjU2IjoiMDc2ODhmZmRhZGIyMmMyYWI1NThmMGJhMjE5M2FmN2VjY2Y4OGMwZmI4MzNiY2MyMGZkZjc1NDRlNmU1YmE0NSIsInNpemUiOjExNzh9LHsicGF0aCI6InRyYWNrZWQtZXZlbnRzLmpzb25sIiwic2hhMjU2IjoiODI0NjlkZGRjZWYyNmMzZmYyNDFiYTliZWE4ODYxNTQyOWNhNDU5NThhNGM0ODMyN2QyYjAyZDRkMDAwNmUyYiIsInNpemUiOjE0MjYwfSx7InBhdGgiOiJ0cmFja2VkLWV2ZW50cy5qc29ubC5zZWFsZWQiLCJzaGEyNTYiOiI0MmJkYjE0YWE3MWU5NzY4ZTdmYzA1MjJiMTdiNTIxZmVmYjExMzY5NmYzM2RhNTFhYjViNGI0N2M1MDIyODJkIiwic2l6ZSI6NjV9LHsicGF0aCI6InZlcmlmaWNhdGlvbi5qc29uIiwic2hhMjU2IjoiNWEzMjg4ZWRhNmRmYzIyZWU5MzJjYjViY2NlYzUwZGVhN2NiYWYzNzk0NDQ2MDE0NGZlYWI5NTgwNzhmYmM3NSIsInNpemUiOjI4MX0seyJwYXRoIjoid29ya2xvYWQvcmF3LXJlY29yZHMuYmluIiwic2hhMjU2IjoiMTI0MTA1MDgzZGExNjllZDcwM2U1ZWVjZjg0Y2U0MTM2ZDUxYWQyZjM0NWEwYTk3NWExYzhlMzYxZjQ4MTljYyIsInNpemUiOjY0OTV9XSwibWVya2xlUm9vdCI6IjNhODNiZDBmNDlhNGQ3ZTNlNTNmZTFiMDk5M2FiNmYzYjU0YTQ1MWMzMDQ5OTQ2ODM5YTZhNzdhMjEwMTQxN2YiLCJzaWduYXR1cmVGb3JtYXQiOiJjb3NlLXNpZ24xLWVkMjU1MTkiLCJzZWFsZWRBdCI6IjIwMjYtMDktMjFUMjM6MDI6NDIuOTEyMzMxWiJ9WEAoABM0kAhoXCabV4mSWEEF1PbQfBcBjZq6bqSelQWI1eAIUcbJs0hi5HkGyIRAAyjKLd2dK7Fct7ZAeSui/jUB","signatureFormat":"cose-sign1-ed25519","sealedAt":"2026-09-21T23:02:42.912331Z"},"files":{"api-run-spec.json":"eyJzY2hlbWFWZXJzaW9uIjoidjEiLCJoYXJuZXNzIjoiaCIsInN1aXRlIjoicyIsImJhY2tlbmQiOiJtb2NrLWRhdGEiLCJwYXJhbWV0ZXJzIjp7InNjZW5hcmlvIjoibWlzc2luZy11c2FnZSJ9fQo=","capability-manifest.json":"eyJzY2hlbWFWZXJzaW9uIjoidjEiLCJiYWNrZW5kIjoibW9jay1kYXRhIiwidmVyc2lvbiI6InBoYXNlMSIsInRydXN0RG9tYWluIjoibW9jayIsImNhcGFiaWxpdGllcyI6W3siZXZlbnRGYW1pbHkiOiJwcm9jZXNzIiwib2JzZXJ2YXRpb24iOiJiZXN0X2VmZm9ydCIsImVuZm9yY2VtZW50IjoiYXVkaXRfb25seSIsInJldGVudGlvbiI6InJ1biJ9LHsiZXZlbnRGYW1pbHkiOiJmaWxlc3lzdGVtIiwib2JzZXJ2YXRpb24iOiJiZXN0X2VmZm9ydCIsImVuZm9yY2VtZW50IjoiYXVkaXRfb25seSIsInJldGVudGlvbiI6InJ1biJ9LHsiZXZlbnRGYW1pbHkiOiJuZXR3b3JrIiwib2JzZXJ2YXRpb24iOiJiZXN0X2VmZm9ydCIsImVuZm9yY2VtZW50IjoiYXVkaXRfb25seSIsInJldGVudGlvbiI6InJ1biJ9LHsiZXZlbnRGYW1pbHkiOiJtb2RlbCIsIm9ic2VydmF0aW9uIjoiYmVzdF9lZmZvcnQiLCJlbmZvcmNlbWVudCI6ImF1ZGl0X29ubHkiLCJyZXRlbnRpb24iOiJydW4ifV0sImRpZ2VzdCI6ImIyYzZhNGRkNDA3ZGYxYWRkM2IwYjY3OWE2Zjk5MzgyYzNmMTYzZTBhYmMzMTYzMGE3YzQ4ZGU1NDAxYjJjYWYifQo=","observation-plan.json":"eyJzY2hlbWFWZXJzaW9uIjoidjEiLCJyZXF1aXJlbWVudHMiOm51bGwsInNlbnNvckNvbmZpZ3MiOlsibW9jay1taXNzaW5nLXVzYWdlIl0sInBsYWludGV4dFJlcXVpcmVkIjpmYWxzZSwicHJlc2VydmVEZXN0aW5hdGlvbnMiOmZhbHNlLCJvcGFxdWVUcmFmZmljUG9saWN5IjoiYWxsb3cifQo=","raw-records.json":"W3sicnVuSWQiOiJydW4tMDczMjQzNWUyYzk0NTg0OTMxYTMxMWMyNzE5YjRjODAiLCJzZW5zb3JJZCI6Im1vY2stc3lzdGVtIiwiYm9vdElkIjoibW9jay1ib290LTEiLCJzb3VyY2VTZXEiOjEsIm9ic2VydmVkTW9ub3RvbmljTnMiOm51bGwsIm9ic2VydmVkV2FsbFRpbWUiOm51bGwsInJlY29yZFR5cGUiOiJwcm9jZXNzL2V4ZWMiLCJlbmNvZGluZyI6Impzb24iLCJwYXlsb2FkIjoiZXlKd2NtOWpaWE56U1dRaU9pSndjbTlqTFRFaUxDSmhjbWQySWpwYkltWnBlSFIxY21VaVhYMD0iLCJwcmV2aW91c1JlY29yZFNoYTI1NiI6IiIsInJlY29yZFNoYTI1NiI6IjAyYmUzYjlkNzdhNDcwODIxNzI5YjFjMjBkNzY3NWJjZDRmZDBkYjJiMTg1OWQ3NGY0OGNkZmRiNjkyZThhZWEifSx7InJ1bklkIjoicnVuLTA3MzI0MzVlMmM5NDU4NDkzMWEzMTFjMjcxOWI0YzgwIiwic2Vuc29ySWQiOiJtb2NrLXN5c3RlbSIsImJvb3RJZCI6Im1vY2stYm9vdC0xIiwic291cmNlU2VxIjoyLCJvYnNlcnZlZE1vbm90b25pY05zIjpudWxsLCJvYnNlcnZlZFdhbGxUaW1lIjpudWxsLCJyZWNvcmRUeXBlIjoiZmlsZS93cml0ZSIsImVuY29kaW5nIjoianNvbiIsInBheWxvYWQiOiJleUptYVd4bFNXUWlPaUptYVd4bExURWlMQ0p3WVhSb0lqb2lMM2R2Y210emNHRmpaUzl5WlhOMWJIUXVkSGgwSWl3aVlubDBaWE1pT2pOOSIsInByZXZpb3VzUmVjb3JkU2hhMjU2IjoiMDJiZTNiOWQ3N2E0NzA4MjE3MjliMWMyMGQ3Njc1YmNkNGZkMGRiMmIxODU5ZDc0ZjQ4Y2RmZGI2OTJlOGFlYSIsInJlY29yZFNoYTI1NiI6ImI3YmY5NWFjZGQwOTdjY2IyNjY4NGQwNDFhZTIwMWRkZGIwY2Y4YmE5NGIwOGFmMGY3ZjlkZDc1ZGI0ODlmZjEifSx7InJ1bklkIjoicnVuLTA3MzI0MzVlMmM5NDU4NDkzMWEzMTFjMjcxOWI0YzgwIiwic2Vuc29ySWQiOiJtb2NrLXN5c3RlbSIsImJvb3RJZCI6Im1vY2stYm9vdC0xIiwic291cmNlU2VxIjozLCJvYnNlcnZlZE1vbm90b25pY05zIjpudWxsLCJvYnNlcnZlZFdhbGxUaW1lIjpudWxsLCJyZWNvcmRUeXBlIjoiZG5zL3F1ZXJ5IiwiZW5jb2RpbmciOiJqc29uIiwicGF5bG9hZCI6ImV5SnhkV1Z5ZVU1aGJXVWlPaUp3Y205MmFXUmxjaTVsZUdGdGNHeGxMblJsYzNRaUxDSnhkV1Z5ZVZSNWNHVWlPaUpCSW4wPSIsInByZXZpb3VzUmVjb3JkU2hhMjU2IjoiYjdiZjk1YWNkZDA5N2NjYjI2Njg0ZDA0MWFlMjAxZGRkYjBjZjhiYTk0YjA4YWYwZjdmOWRkNzVkYjQ4OWZmMSIsInJlY29yZFNoYTI1NiI6ImFjMzEyNGIyMzk2ZDNkMDBiMDE5YjNiYTQzM2ZhNjE4ZDM0ZmI3N2U1YzNiNjk3NTJkMGYyYTUxMWQ3MTRmNmUifSx7InJ1bklkIjoicnVuLTA3MzI0MzVlMmM5NDU4NDkzMWEzMTFjMjcxOWI0YzgwIiwic2Vuc29ySWQiOiJtb2NrLXBsYWludGV4dCIsImJvb3RJZCI6Im1vY2stYm9vdC0xIiwic291cmNlU2VxIjoxLCJvYnNlcnZlZE1vbm90b25pY05zIjpudWxsLCJvYnNlcnZlZFdhbGxUaW1lIjpudWxsLCJyZWNvcmRUeXBlIjoibmV0d29yay9wbGFpbnRleHQiLCJlbmNvZGluZyI6Impzb24iLCJwYXlsb2FkIjoiZXlKaWIzVnVaR0Z5ZVNJNkluTmhibVJpYjNnaUxDSmpZWEIwZFhKbFVHOXBiblFpT2lKdGIyTnJMV0p2ZFc1a1lYSjVJaXdpWTI5dWJtVmpkR2x2Ymtsa0lqb2liVzlqYXkxamIyNXVJaXdpYzNSeVpXRnRTV1FpT2lKdGIyTnJMWE4wY21WaGJTSXNJblJ5WVc1emNHOXlkQ0k2SW5SamNDSXNJbVJwY21WamRHbHZiaUk2SW1WbmNtVnpjeUlzSW5ObGNYVmxibU5sSWpveExDSnZabVp6WlhRaU9qQXNJbk52ZFhKalpTSTZleUpwY0NJNklqRXdMakF1TUM0eUlpd2ljRzl5ZENJNk5EUTBORFI5TENKa1pYTjBhVzVoZEdsdmJpSTZleUp3YjNKMElqbzBORE1zSW1odmMzUnVZVzFsSWpvaWNISnZkbWxrWlhJdVpYaGhiWEJzWlM1MFpYTjBJbjBzSW5CeWIzUnZZMjlzSWpwN0ltNWhiV1VpT2lKb2RIUndJaXdpZG1WeWMybHZiaUk2SWpFdU1TSjlMQ0p3WVhsc2IyRmtJanA3SW1WdVkyOWthVzVuSWpvaWRYUm1PQ0lzSW1sdWJHbHVaU0k2SWxCUFUxUWdMM1l4TDJOb1lYUXZZMjl0Y0d4bGRHbHZibk1nU0ZSVVVDOHhMakZjY2x4dVNHOXpkRG9nY0hKdmRtbGtaWEl1WlhoaGJYQnNaUzUwWlhOMFhISmNibFZ6WlhJdFFXZGxiblE2SUVkdkxXaDBkSEF0WTJ4cFpXNTBMekV1TVZ4eVhHNURiMjUwWlc1MExVeGxibWQwSWl3aWJHVnVaM1JvSWpveE1UQXNJbk5vWVRJMU5pSTZJbVF5Tm1FMVpXTTRNMk5qWXpJM1pqY3dNREV6WVdFell6VTRZVGxtTkRsbE9HVmlaak16WW1VeU5qTXhNR1ExT0RReFpXTmtOelUzWkRSbVptTTFNbVFpZlN3aVkyRndkSFZ5WlNJNmV5SnRaWFJvYjJRaU9pSnRiMk5ySWl3aVltRmphMlZ1WkNJNkltMXZZMnN0WkdGMFlTSXNJblpsY21sbWFXVmtJanBtWVd4elpYMTkiLCJwcmV2aW91c1JlY29yZFNoYTI1NiI6IiIsInJlY29yZFNoYTI1NiI6ImVhYzdlZjFjZjdlZjc0NTQzNTI3OTQwNjU4NWEy